{
  "clientProposalId": "00000000-0000-4000-8000-000000000011",
  "contextId": "00000000-0000-4000-8000-000000000011",
  "analysisId": "00000000-0000-4000-8000-000000000011",
  "executionId": "00000000-0000-4000-8000-000000000012",
  "selection": "FULL",
  "outputId": null,
  "conversationId": null,
  "turnId": null
}
